{
  "schema_version": "1.0",
  "id": "sig_opportunity_001",
  "occurred_at": "2026-04-20T12:05:00Z",
  "producer": "example.domain",
  "entity": "route.jfk-lhr",
  "event": "window.opened",
  "channel": "opportunity",
  "valence": 0.84,
  "energy": 0.64,
  "tension": 0.24,
  "intensity": 0.73,
  "hue": 92,
  "pulse": 0.58,
  "confidence": 0.9,
  "metadata": {
    "route": "JFK-LHR",
    "window": "38-52 days"
  }
}
