{
  "schema_version": "1.0",
  "id": "sig_handoff_001",
  "occurred_at": "2026-04-20T12:06:00Z",
  "producer": "example.agent",
  "entity": "agent.example.worker_01",
  "event": "handoff.requested",
  "channel": "handoff",
  "valence": 0.54,
  "energy": 0.62,
  "tension": 0.71,
  "intensity": 0.68,
  "hue": 278,
  "pulse": 0.72,
  "metadata": {
    "receiver": "human.operator"
  }
}
