{
  "schema_version": "1.0",
  "id": "sig_browser_warning_001",
  "occurred_at": "2026-04-20T12:10:00Z",
  "producer": "example.browser",
  "entity": "agent.example.worker_01",
  "event": "tool_call.issued",
  "channel": "warning",
  "valence": 0.33,
  "energy": 0.72,
  "tension": 0.79,
  "intensity": 0.76,
  "hue": 44,
  "pulse": 0.82,
  "confidence": 0.86,
  "ttl_ms": 12000,
  "metadata": {
    "tool": "web_search",
    "source": "browser-example"
  }
}
