{
  "schema_version": "1.0",
  "id": "sig_nominal_001",
  "occurred_at": "2026-04-20T12:00:00Z",
  "producer": "example.agent",
  "entity": "agent.example.worker_01",
  "event": "agent.idle",
  "channel": "nominal",
  "valence": 0.66,
  "energy": 0.18,
  "tension": 0.12,
  "intensity": 0.26,
  "hue": 152,
  "pulse": 0.22
}
